<?xml version="1.0" encoding="utf-8"?>
<!-- XSD ver.23/08/2021 -->
<xs:schema xmlns:ds="http://www.w3.org/2000/09/xmldsig#" xmlns:xsi="http://www.w3.org/2001/XMLSchema-instance"
           attributeFormDefault="unqualified" elementFormDefault="qualified"
           xmlns:xs="http://www.w3.org/2001/XMLSchema">
    <xs:element name="facturaComputarizadaPrevalorada">
        <xs:complexType>
            <xs:sequence>
                <xs:element name="cabecera">
                    <xs:complexType>
                        <xs:sequence>
                            <xs:element name="nitEmisor">
                                <xs:simpleType>
                                    <xs:restriction base="xs:integer">
                                        <xs:minInclusive value="1"/>
                                        <xs:maxInclusive value="9999999999999"/>
                                    </xs:restriction>
                                </xs:simpleType>
                            </xs:element>
                            <xs:element name="razonSocialEmisor">
                                <xs:simpleType>
                                    <xs:restriction base="xs:string">
                                        <xs:minLength value="1"/>
                                        <xs:maxLength value="200"/>
                                    </xs:restriction>
                                </xs:simpleType>
                            </xs:element>
                            <xs:element name="municipio">
                                <xs:simpleType>
                                    <xs:restriction base="xs:string">
                                        <xs:minLength value="1"/>
                                        <xs:maxLength value="25"/>
                                    </xs:restriction>
                                </xs:simpleType>
                            </xs:element>
                            <xs:element name="telefono" nillable="true">
                                <xs:simpleType>
                                    <xs:restriction base="xs:string">
                                        <xs:minLength value="1"/>
                                        <xs:maxLength value="25"/>
                                    </xs:restriction>
                                </xs:simpleType>
                            </xs:element>
                            <xs:element name="numeroFactura">
                                <xs:simpleType>
                                    <xs:restriction base="xs:integer">
                                        <xs:minInclusive value="1"/>
                                        <xs:maxInclusive value="9999999999"/>
                                    </xs:restriction>
                                </xs:simpleType>
                            </xs:element>
                            <xs:element name="cuf">
                                <xs:simpleType>
                                    <xs:restriction base="xs:string">
                                        <xs:minLength value="1"/>
                                        <xs:maxLength value="100"/>
                                    </xs:restriction>
                                </xs:simpleType>
                            </xs:element>
                            <xs:element name="cufd">
                                <xs:simpleType>
                                    <xs:restriction base="xs:string">
                                        <xs:minLength value="1"/>
                                        <xs:maxLength value="100"/>
                                    </xs:restriction>
                                </xs:simpleType>
                            </xs:element>
                            <xs:element name="codigoSucursal">
                                <xs:simpleType>
                                    <xs:restriction base="xs:integer">
                                        <xs:minInclusive value="0"/>
                                        <xs:maxInclusive value="9999"/>
                                    </xs:restriction>
                                </xs:simpleType>
                            </xs:element>
                            <xs:element name="direccion">
                                <xs:simpleType>
                                    <xs:restriction base="xs:string">
                                        <xs:minLength value="1"/>
                                        <xs:maxLength value="500"/>
                                    </xs:restriction>
                                </xs:simpleType>
                            </xs:element>
                            <xs:element name="codigoPuntoVenta" nillable="true">
                                <xs:simpleType>
                                    <xs:restriction base="xs:integer">
                                        <xs:minInclusive value="0"/>
                                        <xs:maxInclusive value="9999"/>
                                    </xs:restriction>
                                </xs:simpleType>
                            </xs:element>
                            <xs:element name="fechaEmision" type="xs:dateTime"/>
                            <xs:element name="nombreRazonSocial" type="xs:string" fixed="S/N"/>
                            <xs:element name="codigoTipoDocumentoIdentidad" type="xs:integer" fixed="5"/>
                            <xs:element name="numeroDocumento" type="xs:integer" fixed="0"/>
                            <xs:element name="codigoCliente" type="xs:string" fixed="N/A"/>
                            <xs:element name="codigoMetodoPago">
                                <xs:simpleType>
                                    <xs:restriction base="xs:integer">
                                        <xs:minInclusive value="1"/>
                                        <xs:maxInclusive value="308"/>
                                    </xs:restriction>
                                </xs:simpleType>
                            </xs:element>
                            <xs:element name="numeroTarjeta" nillable="true">
                                <xs:simpleType>
                                    <xs:restriction base="xs:integer">
                                        <xs:minInclusive value="0"/>
                                        <xs:maxInclusive value="9999999999999999"/>
                                    </xs:restriction>
                                </xs:simpleType>
                            </xs:element>
                            <xs:element name="montoTotal">
                                <xs:simpleType>
                                    <xs:restriction base="xs:decimal">
                                        <xs:totalDigits value="17"/>
                                        <xs:fractionDigits value="2"/>
                                        <xs:minExclusive value="0"/>
                                    </xs:restriction>
                                </xs:simpleType>
                            </xs:element>
                            <xs:element name="montoTotalSujetoIva">
                                <xs:simpleType>
                                    <xs:restriction base="xs:decimal">
                                        <xs:totalDigits value="17"/>
                                        <xs:fractionDigits value="2"/>
                                        <xs:minInclusive value="0"/>
                                    </xs:restriction>
                                </xs:simpleType>
                            </xs:element>
                            <xs:element name="codigoMoneda">
                                <xs:simpleType>
                                    <xs:restriction base="xs:integer">
                                        <xs:minInclusive value="1"/>
                                        <xs:maxInclusive value="154"/>
                                    </xs:restriction>
                                </xs:simpleType>
                            </xs:element>
                            <xs:element name="tipoCambio">
                                <xs:simpleType>
                                    <xs:restriction base="xs:decimal">
                                        <xs:totalDigits value="17"/>
                                        <xs:fractionDigits value="2"/>
                                        <xs:minExclusive value="0"/>
                                    </xs:restriction>
                                </xs:simpleType>
                            </xs:element>
                            <xs:element name="montoTotalMoneda">
                                <xs:simpleType>
                                    <xs:restriction base="xs:decimal">
                                        <xs:totalDigits value="17"/>
                                        <xs:fractionDigits value="2"/>
                                        <xs:minExclusive value="0"/>
                                    </xs:restriction>
                                </xs:simpleType>
                            </xs:element>
                            <xs:element name="leyenda">
                                <xs:simpleType>
                                    <xs:restriction base="xs:string">
                                        <xs:minLength value="1"/>
                                        <xs:maxLength value="200"/>
                                    </xs:restriction>
                                </xs:simpleType>
                            </xs:element>
                            <xs:element name="usuario">
                                <xs:simpleType>
                                    <xs:restriction base="xs:string">
                                        <xs:minLength value="1"/>
                                        <xs:maxLength value="100"/>
                                    </xs:restriction>
                                </xs:simpleType>
                            </xs:element>
                            <xs:element name="codigoDocumentoSector" type="xs:integer" fixed="23"/>
                        </xs:sequence>
                    </xs:complexType>
                </xs:element>
                <xs:element name="detalle" minOccurs="1" maxOccurs="1">
                    <xs:complexType>
                        <xs:sequence>
                            <xs:element name="actividadEconomica">
                                <xs:simpleType>
                                    <xs:restriction base="xs:string">
                                        <xs:minLength value="1"/>
                                        <xs:maxLength value="10"/>
                                    </xs:restriction>
                                </xs:simpleType>
                            </xs:element>
                            <xs:element name="codigoProductoSin">
                                <xs:simpleType>
                                    <xs:restriction base="xs:integer">
                                        <xs:minInclusive value="1"/>
                                        <xs:maxInclusive value="99999999"/>
                                    </xs:restriction>
                                </xs:simpleType>
                            </xs:element>
                            <xs:element name="codigoProducto">
                                <xs:simpleType>
                                    <xs:restriction base="xs:string">
                                        <xs:minLength value="1"/>
                                        <xs:maxLength value="50"/>
                                    </xs:restriction>
                                </xs:simpleType>
                            </xs:element>
                            <xs:element name="descripcion">
                                <xs:simpleType>
                                    <xs:restriction base="xs:string">
                                        <xs:minLength value="1"/>
                                        <xs:maxLength value="500"/>
                                    </xs:restriction>
                                </xs:simpleType>
                            </xs:element>
                            <xs:element name="cantidad">
                                <xs:simpleType>
                                    <xs:restriction base="xs:decimal">
                                        <xs:totalDigits value="17"/>
                                        <xs:fractionDigits value="2"/>
                                        <xs:minExclusive value="0"/>
                                    </xs:restriction>
                                </xs:simpleType>
                            </xs:element>
                            <xs:element name="unidadMedida">
                                <xs:simpleType>
                                    <xs:restriction base="xs:integer">
                                        <xs:minInclusive value="1"/>
                                        <xs:maxInclusive value="200"/>
                                    </xs:restriction>
                                </xs:simpleType>
                            </xs:element>
                            <xs:element name="precioUnitario">
                                <xs:simpleType>
                                    <xs:restriction base="xs:decimal">
                                        <xs:totalDigits value="17"/>
                                        <xs:fractionDigits value="2"/>
                                        <xs:minExclusive value="0"/>
                                    </xs:restriction>
                                </xs:simpleType>
                            </xs:element>
                            <xs:element name="montoDescuento" nillable="true">
                                <xs:simpleType>
                                    <xs:restriction base="xs:decimal">
                                        <xs:totalDigits value="17"/>
                                        <xs:fractionDigits value="2"/>
                                        <xs:minInclusive value="0"/>
                                    </xs:restriction>
                                </xs:simpleType>
                            </xs:element>
                            <xs:element name="subTotal">
                                <xs:simpleType>
                                    <xs:restriction base="xs:decimal">
                                        <xs:totalDigits value="17"/>
                                        <xs:fractionDigits value="2"/>
                                        <xs:minExclusive value="0"/>
                                    </xs:restriction>
                                </xs:simpleType>
                            </xs:element>
                        </xs:sequence>
                    </xs:complexType>
                </xs:element>
            </xs:sequence>
        </xs:complexType>
    </xs:element>
</xs:schema>