<?xml version="1.0" encoding="utf-8"?>
<facturaComputarizadaPrevalorada xmlns:xsi="http://www.w3.org/2001/XMLSchema-instance" xsi:noNamespaceSchemaLocation="facturaComputarizadaPrevalorada.xsd">
      <cabecera>
          <nitEmisor>5152377019</nitEmisor>
          <razonSocialEmisor>PASSWORD</razonSocialEmisor>
          <municipio>CERCADO - COCHABAMBA</municipio>
          <telefono>4511518 *(591)79999097</telefono>
          <numeroFactura>553</numeroFactura>
          <cuf>1608A399D64B18406F2033066E6E20062C45EDF4FAA6351D27BD1D6D74</cuf>
          <cufd>BQXxCKlhQRkE=Nzzc0OTIzNjFEMjc=Q3x4QXZRVkpXVUJIzNURFQzJFNTdGQ</cufd>
          <codigoSucursal>0</codigoSucursal>
          <direccion>URUGUAY Nº 454, ENTRE SAN MARTIN Y 25 DE MAYO</direccion>
          <codigoPuntoVenta>1</codigoPuntoVenta>
          <fechaEmision>2022-09-20T16:53:20.789</fechaEmision>
          <nombreRazonSocial>S/N</nombreRazonSocial>
          <codigoTipoDocumentoIdentidad>5</codigoTipoDocumentoIdentidad>
          <numeroDocumento>0</numeroDocumento>
          <codigoCliente>N/A</codigoCliente>
          <codigoMetodoPago>1</codigoMetodoPago>
          <numeroTarjeta>0</numeroTarjeta>
          <montoTotal>90.00</montoTotal>
          <montoTotalSujetoIva>90</montoTotalSujetoIva>
          <codigoMoneda>1</codigoMoneda>
          <tipoCambio>1</tipoCambio>
          <montoTotalMoneda>90.00</montoTotalMoneda>
          <leyenda>Ley N° 453: Está prohibido importar, distribuir o comercializar productos expirados o prontos a expirar.</leyenda>
          <usuario>Administrador</usuario>
          <codigoDocumentoSector>23</codigoDocumentoSector>
      </cabecera>
      <detalle>
           <actividadEconomica>465000</actividadEconomica>
           <codigoProductoSin>611849</codigoProductoSin>
           <codigoProducto>0152502326</codigoProducto>
           <descripcion>WIRELESS PCI-XPRESS 150MBPS TP-LINK TL-WN781ND</descripcion>
           <cantidad>1</cantidad>
           <unidadMedida>47</unidadMedida>
           <precioUnitario>90.00</precioUnitario>
           <montoDescuento>0</montoDescuento>
           <subTotal>90.00</subTotal>
      </detalle>
</facturaComputarizadaPrevalorada>