<?xml version="1.0" encoding="UTF-8" standalone="yes"?>
<facturaComputarizadaPrevalorada xsi:noNamespaceSchemaLocation="facturaComputarizadaPrevalorada.xsd" xmlns:xsi="http://www.w3.org/2001/XMLSchema-instance">
    <cabecera>
        <nitEmisor>1003579028</nitEmisor>
        <razonSocialEmisor>PRUEBA</razonSocialEmisor>
        <municipio>LA PAZ - BOLIVIA</municipio>
        <telefono>60117860</telefono>
        <numeroFactura>1</numeroFactura>
        <cuf>44AAEC00DBD34C53C3E42C6EE4251B5145129506A367A75AC82F24C74</cuf>
        <cufd>BQUE+QytqQUDBKVUFOSVRPQkxVRFZNVFVJBMDAwMDAwM</cufd>
        <codigoSucursal>0</codigoSucursal>
        <direccion>AV. JORGE LOPEZ #123</direccion>
        <codigoPuntoVenta>0</codigoPuntoVenta>
        <fechaEmision>2021-10-06T16:03:49.100</fechaEmision>
        <nombreRazonSocial>S/N</nombreRazonSocial>
        <codigoTipoDocumentoIdentidad>5</codigoTipoDocumentoIdentidad>
        <numeroDocumento>0</numeroDocumento>
        <codigoCliente>N/A</codigoCliente>
        <codigoMetodoPago>1</codigoMetodoPago>
        <numeroTarjeta/>
        <montoTotal>100</montoTotal>
        <montoTotalSujetoIva>100</montoTotalSujetoIva>
        <codigoMoneda>1</codigoMoneda>
        <tipoCambio>1</tipoCambio>
        <montoTotalMoneda>100</montoTotalMoneda>
        <leyenda>Ley N° 453: Tienes derecho a recibir información sobre las características y contenidos de los servicios que utilices.</leyenda>
        <usuario>pperez</usuario>
        <codigoDocumentoSector>23</codigoDocumentoSector>
    </cabecera>
</facturaComputarizadaPrevalorada>